root@lamp-ubuntu-s-1vcpu-1gb-tor1-01:~# tcpdump -A -i eth0
tcpdump: verbose output suppressed, use -v[v]... for full protocol decode
listening on eth0, link-type EN10MB (Ethernet), snapshot length 262144 bytes
18:30:19.464652 IP lamp-ubuntu-s-1vcpu-1gb-tor1-01.ssh > 198.96.84.204.53075: Flags [P.], seq 958989816:958989868, ack 2525416671, win 501, length 52
E..\5)@.@.a3...D.`T....S9)......P....~...V..g.5....hW..N..z.C]z.F..v0...t..>.....U..........
18:30:19.466651 IP lamp-ubuntu-s-1vcpu-1gb-tor1-01.ssh > 198.96.84.204.53075: Flags [P.], seq 52:160, ack 1, win 501, length 108
E...5*@.@.`....D.`T....S9).,....P.......P.E....I{       )...ud.<..N.>6.. gU(.....E...y..5-.[.5r..u8..\U.h...'.0..5@W.=..*....H..`..VuD..UH/l...q4Y^E.F.r..
18:30:19.466729 IP lamp-ubuntu-s-1vcpu-1gb-tor1-01.ssh > 198.96.84.204.53075: Flags [P.], seq 160:316, ack 1, win 501, length 156
E...5+@.@.`....D.`T....S9)......P.......a..=`... .P...K...L..C...."..^.T!...fo.nb{..9O..g9=..z.....
.....K...cr)..N5...,p..C!JmD.m.J... N..`...O.h.].....8x..; .....`.U.......      ....!.l(........l....
18:30:19.466820 IP lamp-ubuntu-s-1vcpu-1gb-tor1-01.ssh > 198.96.84.204.53075: Flags [P.], seq 316:420, ack 1, win 501, length 104
E...5,@.@.`....D.`T....S9).4....P.........X.Zd...;<..M...M..n......N,<.Q.]..}.Mp.H...c.a.....MU.....\.X<..-I.By...y.d....VeM.&......!..4[.!.....
18:30:19.469496 IP 198.96.84.204.53075 > lamp-ubuntu-s-1vcpu-1gb-tor1-01.ssh: Flags [.], ack 420, win 509, length 0
E..(..@.y....`T....D.S......9)..P.........
18:30:19.564304 IP lamp-ubuntu-s-1vcpu-1gb-tor1-01.43838 > 67.207.67.2.domain: 27024+ [1au] PTR? 204.84.96.198.in-addr.arpa. (55)
E..S")..@.H....DC.C..>.5.?.%i............204.84.96.198.in-addr.arpa.......)........
18:30:19.564425 IP lamp-ubuntu-s-1vcpu-1gb-tor1-01.41327 > 67.207.67.2.domain: 16319+ [1au] PTR? 204.84.96.198.in-addr.arpa. (55)
E..S....@..B...DC.C..o.5.?.%?............204.84.96.198.in-addr.arpa.......)........
18:30:19.564482 IP lamp-ubuntu-s-1vcpu-1gb-tor1-01.41230 > 67.207.67.3.domain: Flags [S], seq 2522881764, win 64240, options [mss 1460,sackOK,TS val 3039768412 ecr 0,nop,wscale 7,tfo  cookiereq,nop,nop], length 0
E..@#.@.@......DC.C....5.`.....................
.//\........"...
18:30:19.564774 IP 67.207.67.2.domain > lamp-ubuntu-s-1vcpu-1gb-tor1-01.43838: 27024 NXDomain 0/1/1 (120)
E.......<...C.C....D.5.>..6.i............204.84.96.198.in-addr.arpa..............K.5.gbc.georgebrown.ca.
hostmaster.<w..........X..Q.......)........
18:30:19.564774 IP 67.207.67.2.domain > lamp-ubuntu-s-1vcpu-1gb-tor1-01.41327: 16319 NXDomain 0/1/1 (120)
E.......<...C.C....D.5.o..jh?............204.84.96.198.in-addr.arpa..............K.5.gbc.georgebrown.ca.
hostmaster.<w..........X..Q.......)........
18:30:19.565005 IP lamp-ubuntu-s-1vcpu-1gb-tor1-01.43838 > 67.207.67.2.domain: 27024+ PTR? 204.84.96.198.in-addr.arpa. (44)
E..H"*..@.H....DC.C..>.5.4..i............204.84.96.198.in-addr.arpa.....
18:30:19.565024 IP 67.207.67.3.domain > lamp-ubuntu-s-1vcpu-1gb-tor1-01.41230: Flags [S.], seq 3320925062, ack 2522881765, win 65160, options [mss 1460,sackOK,TS val 3217428956 ecr 3039768412,nop,wscale 9], length 0
E..<..@.<...C.C....D.5....K..`.......`.........
.....//\...
18:30:19.565047 IP lamp-ubuntu-s-1vcpu-1gb-tor1-01.41230 > 67.207.67.3.domain: Flags [.], ack 1, win 502, options [nop,nop,TS val 3039768413 ecr 3217428956], length 0
E..4#.@.@......DC.C....5.`....K............
.//]....
18:30:19.565083 IP lamp-ubuntu-s-1vcpu-1gb-tor1-01.41327 > 67.207.67.2.domain: 16319+ PTR? 204.84.96.198.in-addr.arpa. (44)
E..H....@..L...DC.C..o.5.4..?............204.84.96.198.in-addr.arpa.....
18:30:19.565096 IP lamp-ubuntu-s-1vcpu-1gb-tor1-01.41230 > 67.207.67.3.domain: Flags [P.], seq 1:47, ack 1, win 502, options [nop,nop,TS val 3039768413 ecr 3217428956], length 46 16102+ PTR? 204.84.96.198.in-addr.arpa. (44)
E..b#.@.@......DC.C....5.`....K......*.....
.//].....,>............204.84.96.198.in-addr.arpa.....
18:30:19.565404 IP 67.207.67.2.domain > lamp-ubuntu-s-1vcpu-1gb-tor1-01.43838: 27024 NXDomain 0/1/0 (109)
E.......<...C.C....D.5.>.u9.i............204.84.96.198.in-addr.arpa..............K.5.gbc.georgebrown.ca.
hostmaster.<w..........X..Q.....
18:30:19.565564 IP 67.207.67.2.domain > lamp-ubuntu-s-1vcpu-1gb-tor1-01.41327: 16319 NXDomain 0/1/0 (109)
E.......<...C.C....D.5.o.ul.?............204.84.96.198.in-addr.arpa..............K.5.gbc.georgebrown.ca.
hostmaster.<w..........X..Q.....
18:30:19.565692 IP 67.207.67.3.domain > lamp-ubuntu-s-1vcpu-1gb-tor1-01.41230: Flags [.], ack 47, win 128, options [nop,nop,TS val 3217428957 ecr 3039768413], length 0
E..4..@.<...C.C....D.5....K..`......H......
.....//]
18:30:19.565870 IP 67.207.67.3.domain > lamp-ubuntu-s-1vcpu-1gb-tor1-01.41230: Flags [P.], seq 1:112, ack 47, win 128, options [nop,nop,TS val 3217428957 ecr 3039768413], length 111 16102 NXDomain 0/1/0 (109)
E.....@.<...C.C....D.5....K..`......g......
.....//].m>............204.84.96.198.in-addr.arpa..............K.5.gbc.georgebrown.ca.
hostmaster.<w..........X..Q.....
18:30:19.565881 IP lamp-ubuntu-s-1vcpu-1gb-tor1-01.41230 > 67.207.67.3.domain: Flags [.], ack 112, win 502, options [nop,nop,TS val 3039768414 ecr 3217428957], length 0
E..4#.@.@......DC.C....5.`....K............
.//^....
18:30:19.566382 IP lamp-ubuntu-s-1vcpu-1gb-tor1-01.60813 > 67.207.67.2.domain: 30958+ [1au] PTR? 68.246.190.146.in-addr.arpa. (56)
E..Tvw..@..M...DC.C....5.@.&x............68.246.190.146.in-addr.arpa.......)........
18:30:19.566984 IP 67.207.67.2.domain > lamp-ubuntu-s-1vcpu-1gb-tor1-01.60813: 30958 NXDomain 0/1/1 (123)
E.......<...C.C....D.5......x............68.246.190.146.in-addr.arpa..............b.7.ns1.digitalocean.com.
hostmaster..e.d...*0.....       :.......)........
18:30:19.567029 IP lamp-ubuntu-s-1vcpu-1gb-tor1-01.60813 > 67.207.67.2.domain: 30958+ PTR? 68.246.190.146.in-addr.arpa. (45)
E..Ivx..@..W...DC.C....5.5..x............68.246.190.146.in-addr.arpa.....
18:30:19.567365 IP 67.207.67.2.domain > lamp-ubuntu-s-1vcpu-1gb-tor1-01.60813: 30958 NXDomain 0/1/0 (112)
E.......<..
C.C....D.5...x..x............68.246.190.146.in-addr.arpa..............b.7.ns1.digitalocean.com.
hostmaster..e.d...*0.....       :.....
18:30:19.567740 IP lamp-ubuntu-s-1vcpu-1gb-tor1-01.ssh > 198.96.84.204.53075: Flags [P.], seq 420:608, ack 1, win 501, length 188
E...5-@.@.`....D.`T....S9)......P.......h.. ds3...>......{..0.k\.X...9...]I....j[.........7.....nrrZ..m.+..B..)`MF.k.S...s,.5.Q`.....?R....~...I...;..V....9V]_.m.`l...#.JI.~W.A...4p..g...._V..&......u..#L3.4.M5  ...6.............
18:30:19.567814 IP lamp-ubuntu-s-1vcpu-1gb-tor1-01.ssh > 198.96.84.204.53075: Flags [P.], seq 608:812, ack 1, win 501, length 204
E...5.@.@.`....D.`T....S9).X....P.......J...2......~lBO..Bg.5IAF.9.5Q..I..qY=...v.....vK.M.3.[C.YYb.o[.i....y..~. [!.`I!...*..hK1.C..-._S .....d..o.....=..U...;||X..b.....q.....I.....L[.......d-.-.&......re.....3rA/.....B..6....(...d\.=+7.S..j.
18:30:19.567917 IP lamp-ubuntu-s-1vcpu-1gb-tor1-01.ssh > 198.96.84.204.53075: Flags [P.], seq 812:1096, ack 1, win 501, length 284
E..D5/@.@.`E...D.`T....S9)      $....P....f..*..........k.P|..uHn..ik.4....7k."..?.....E.......E.g.E."...(]..^\..k..2...[..6.iP<..0.hi...|5F......V.}#...][....3.!..~.=wwT7.#2...8.X..:$...../2S..TJ}o..4.3l..>.Ar.fv.b....i...6.U.......:..F.(..^B..U......^..!..;3..*.p..q.{...#..mt(IMB.D..      .Zz3.........D.K.a.ph.l".i.....2I.._0:.0 .
18:30:19.567992 IP lamp-ubuntu-s-1vcpu-1gb-tor1-01.ssh > 198.96.84.204.53075: Flags [P.], seq 1096:1300, ack 1, win 501, length 204
E...50@.@.`....D.`T....S9)
@....P..............e....:GKU...OU.v.......m.>.{...;...O8.!Z..n...Y.e.^/.I....8l.7..%..Z...o.<hc./...wu.ObZ...H...      }.{.>....h...b.s.....@!..h....
MOo...ca..\.....K.C.I........T~ ..m..*I......Kz+..i...._..1g^..8c.Zvf..
18:30:19.568041 IP lamp-ubuntu-s-1vcpu-1gb-tor1-01.ssh > 198.96.84.204.53075: Flags [P.], seq 1300:1640, ack 1, win 501, length 340
E..|51@.@.`....D.`T....S9)......P.......;.1m..hmd,.....U..H2..Z.M.Hc.Xs\o............W. m..{.3.&4....H.2A.....g+.....}.t...1>B.%...>_r!2{.+....G..:8=.I..5:+..=';.....'..&......7.s....8D.Z.<_..^..9...<............,..K....b........v.}.4/"....I.[b.N_,t.m$2..i..l)...w,#=.xmt.J...G.f.....R.....G.S.M..b.d.h\}QH...       INE.....*<.d............Uq( .,..Z..y.=c9WA..y.g.q.y.3..tM.....p
i[.n..
18:30:19.568067 IP lamp-ubuntu-s-1vcpu-1gb-tor1-01.ssh > 198.96.84.204.53075: Flags [P.], seq 1640:1676, ack 1, win 501, length 36
E..L52@.@.a:...D.`T....S9).`....P....n..L.5........p$......X_._.....#..3..;.
18:30:19.568127 IP lamp-ubuntu-s-1vcpu-1gb-tor1-01.ssh > 198.96.84.204.53075: Flags [P.], seq 1676:1880, ack 1, win 501, length 204
E...53@.@.`....D.`T....S9)......P..........,...#!.3M.e..h..UZ.m......"].C.T.1Q.....]......W...
k!4..9x....     V.^.k...F..{(n ..1..V.2 .._......)fG.Ig..X.R....<y.........{....X..t......^.....}...=/.#.'.U..,......`  ~1.\..;:.:...W..z........G.
...n.{
18:30:19.568187 IP lamp-ubuntu-s-1vcpu-1gb-tor1-01.ssh > 198.96.84.204.53075: Flags [P.], seq 1880:2116, ack 1, win 501, length 236
E...54@.@.`p...D.`T....S9).P....P....6..Q^....E._.],F....N....A.D.:tFh.Ebi.#.i.m..........x.=:NW'@y. .k.~...N:Oj@..........{p..z_x....|hS.W.|2$..a.5.!. `. .J..V4.....U.K[.i`....>.W.Lx.t.
...#$+n.x.o.A.%2y{<...j...6k.|.0Aa...#...4::..|e.38..T......oh[_...-...m~Xtk6v+.S...{..{.
18:30:19.568248 IP lamp-ubuntu-s-1vcpu-1gb-tor1-01.ssh > 198.96.84.204.53075: Flags [P.], seq 2116:2332, ack 1, win 501, length 216
E...55@.@.`....D.`T....S9).<....P...."....?..........d.$T.aq]....L.e`g2.U.*..0OQ......h.Op.@T!O]...8..i.....S.....|......C..}=....Q+..|m.....<.,..`. .....]..,aEhsR.S...7.p.....r.[|a*.....*v.=K........l5.'...a..e...O.b.\..C2#%..+...g..?..?..H..
...N,3c"..y.
18:30:19.568310 IP lamp-ubuntu-s-1vcpu-1gb-tor1-01.ssh > 198.96.84.204.53075: Flags [P.], seq 2332:2600, ack 1, win 501, length 268
E..456@.@.`N...D.`T....S9)......P....V..P......m...o..< ..J..-]w..x-.Ll|...........9g.......    ..c..(.i.A"....O.Cw/1^c.....1.....\..Y(..V.....1..8...%...d.....k..*1..Sp.1P..j....Rf.P<.e.u.....1K..
6..N......_{aF.w....d.wh..>.?.rB.ie.$L....<0....p.j.PFv.#5..4.ik....+...%.$...B.=...}.$.x.......A.Hh q..8..."..#u
18:30:19.627520 IP lamp-ubuntu-s-1vcpu-1gb-tor1-01.ssh > 198.96.84.204.53075: Flags [P.], seq 2600:2636, ack 1, win 501, length 36
E..L57@.@.a5...D.`T....S9). ....P....n..p....(.D+2.2~....`..Ta..a.....] ...u
18:30:19.660118 IP 198.96.84.204.53075 > lamp-ubuntu-s-1vcpu-1gb-tor1-01.ssh: Flags [.], ack 2636, win 512, length 0
E..(..@.y....`T....D.S......9).DP....g....
^C
36 packets captured
82 packets received by filter
0 packets dropped by kernel

